{
  "event_id": "21111111-2222-4333-8444-555555555555",
  "event_type": "tasking.request.received.v1",
  "schema_version": "1.2.0",
  "occurred_at": "2026-08-07T09:00:00Z",
  "correlation_id": "76666666-7777-4888-8999-aaaaaaaaaaaa",
  "causation_id": null,
  "producer": "tasking-api",
  "data": {
    "request_id": "cbbbbbbb-cccc-4ddd-8eee-ffffffffffff",
    "customer_id": "port-authority-nl",
    "target_name": "Port of Rotterdam",
    "target": {
      "type": "Polygon",
      "coordinates": [[[4.02, 51.92], [4.18, 51.92], [4.18, 51.99], [4.02, 51.99], [4.02, 51.92]]]
    },
    "window": { "start": "2026-08-07T00:00:00Z", "end": "2026-08-14T00:00:00Z" },
    "priority_tier": "COMMERCIAL",
    "bid_credits": 12000,
    "requested_modes": ["SCAN", "STRIPMAP"],
    "constraints": {
      "look_side": "RIGHT",
      "min_incidence_deg": 20,
      "max_incidence_deg": 40,
      "excluded_satellite_ids": ["CAPELLA-14"]
    },
    "submitted_at": "2026-08-07T08:59:59Z"
  }
}
